{
  "kind": "FloatingPointTargetProfile",
  "schema_version": "1.1",
  "profile_id": "x86_64-linux-gnu-clang21",
  "profile_version": "1.0",
  "target_triple": "x86_64-unknown-linux-gnu",
  "abi": "sysv-amd64",
  "compiler": {"family": "clang", "version": "21.1.8"},
  "floating_types": {
    "float": {"format": "ieee754-binary32", "storage_bits": 32, "precision_bits": 24, "alignment_bits": 32, "source": "clang21-target-probe"},
    "double": {"format": "ieee754-binary64", "storage_bits": 64, "precision_bits": 53, "alignment_bits": 64, "source": "clang21-target-probe"},
    "long_double": {"format": "x87-extended80", "storage_bits": 128, "precision_bits": 64, "alignment_bits": 128, "abi_class": "x87", "calling_convention": "sysv-amd64-x87", "variadic": "memory-16-byte", "source": "clang21-target-probe"}
  },
  "evaluation": {"status": "known", "value": {"flt_eval_method": 0, "x87_extended_available": true, "forced_store_rounding": true, "default_excess_precision": "standard"}, "source": "clang21-predefined-macros"},
  "fma": {"status": "known", "value": {"available": true, "default_contraction": "on", "constrained": true}, "source": "clang21-target-and-option-review"},
  "environment": {"status": "known", "value": {"rounding_modes": true, "exception_flags": true, "thread_local": true, "constrained_fp": true, "subnormals": true, "signed_zero": true}, "source": "iso-c-and-clang-target-probe"},
  "target_features": {"status": "known", "value": {"architecture": "x86_64", "x86_intrinsics": true, "riscv_vector": false}, "source": "clang21-target-probe"},
  "math_library": {"status": "unknown", "reason": "selected-by-build-and-runtime-image", "source": "request-context"},
  "sources": {
    "target": "Clang 21.1.8 target and predefined macro probes",
    "abi": "System V AMD64 ABI review",
    "types": "Clang 21.1.8 target layout probe"
  },
  "maintenance": {"owner": "RvPort floating-point scanner", "approved_by": "OpenSpec P1 review", "reviewed_on": "2026-09-23"}
}
